{
  "plan_id_suffix": "alpha_factor_combo_eval",
  "task_class": "eval",
  "objective": "Backtest an equal-weight ensemble of two partially correlated alpha factors against the better single-factor strategy, buy-and-hold, and random signal on a deterministic synthetic price series. Emit Sharpe ratio per strategy under artifacts/metrics.json so the harness can judge whether the ensemble Sharpe exceeds every baseline.",
  "entrypoint": {
    "command": ["python"],
    "args": ["-m", "src.experiment"]
  },
  "resources": {
    "timeout_sec": 120,
    "gpu": null,
    "cpu": 1,
    "memory_gb": 1
  },
  "inputs": {
    "datasets": [],
    "snapshots": []
  },
  "expected_outputs": {
    "metrics_files": ["artifacts/metrics.json"],
    "logs": ["artifacts/run.log"],
    "artifact_dirs": ["artifacts/"]
  },
  "baseline_evidence_requirements": [
    {
      "role": "current_best_known",
      "metric_key": "sharpe_ratio",
      "baseline_key": "current_best_known",
      "operator": "greater_than",
      "margin": 0,
      "required": true
    },
    {
      "role": "naive",
      "metric_key": "sharpe_ratio",
      "baseline_key": "naive",
      "operator": "greater_than",
      "margin": 0,
      "required": true
    },
    {
      "role": "random_or_null",
      "metric_key": "sharpe_ratio",
      "baseline_key": "random_or_null",
      "operator": "greater_than",
      "margin": 0,
      "required": true
    }
  ],
  "guardrails": {
    "allowed_write_roots": ["workspace"],
    "forbidden_actions": [
      "scope_expansion",
      "baseline_changes",
      "shared_memory_write",
      "critic_routing_changes",
      "publication_gate_changes"
    ],
    "scope_policy": "orchestrator_owned_search_policy"
  },
  "failure_index_hints": {
    "domain_tags": ["alpha_factor_combo", "quant"],
    "method_tags": ["sharpe_backtest", "synthetic_returns"],
    "risk_tags": ["small_sample_sharpe", "lookahead_bias_check"]
  },
  "reproducibility": {
    "seed": 42,
    "code_snapshot": "experiment_plan_templates/alpha_factor_combo",
    "data_snapshot": "synthetic_in_memory_seed42"
  }
}
